No.,Time,Source,Destination,Protocol,Length,Info
528,30.183362,10.82.126.202,52.155.169.137,TLSv1.2,141,Application Data
529,30.18353,10.82.126.202,52.155.169.137,TLSv1.2,336,Application Data
530,30.183762,10.82.126.202,52.155.169.137,TLSv1.2,92,Application Data
531,30.183919,10.82.126.202,52.155.169.137,TCP,1452,1950  >  443 [ACK] Seq=785 Ack=3973 Win=130048 Len=1398 [TCP segment of a reassembled PDU]
532,30.183919,10.82.126.202,52.155.169.137,TCP,1452,1950  >  443 [ACK] Seq=2183 Ack=3973 Win=130048 Len=1398 [TCP segment of a reassembled PDU]
533,30.183919,10.82.126.202,52.155.169.137,TLSv1.2,206,Application Data
536,30.195675,10.82.126.202,52.114.133.60,TCP,54,1949  >  443 [ACK] Seq=209 Ack=2797 Win=131328 Len=0
538,30.200713,10.82.126.202,52.114.133.60,TLSv1.2,147,"Client Key Exchange, Change Cipher Spec, Encrypted Handshake Message"
544,30.202337,10.82.126.202,52.155.169.137,TCP,54,1950  >  443 [ACK] Seq=3733 Ack=4108 Win=130048 Len=0
547,30.202605,10.82.126.202,52.155.169.137,TCP,54,1950  >  443 [ACK] Seq=3733 Ack=6117 Win=131328 Len=0
548,30.205569,10.82.126.202,52.155.169.137,TCP,54,"1950  >  443 [FIN, ACK] Seq=3733 Ack=6117 Win=131328 Len=0"
550,30.229536,10.82.126.202,52.155.169.137,TCP,54,1950  >  443 [ACK] Seq=3734 Ack=6118 Win=131328 Len=0
552,30.385407,10.82.126.202,52.114.133.60,TLSv1.2,1026,Application Data
553,30.385919,10.82.126.202,52.114.133.60,TCP,1452,1949  >  443 [ACK] Seq=1274 Ack=4082 Win=130048 Len=1398 [TCP segment of a reassembled PDU]
554,30.385919,10.82.126.202,52.114.133.60,TLSv1.2,1244,Application Data
557,30.480872,10.82.126.202,52.114.133.60,TCP,54,"1949  >  443 [FIN, ACK] Seq=3862 Ack=4441 Win=131328 Len=0"
559,30.571066,10.82.126.202,52.114.133.60,TCP,54,1949  >  443 [ACK] Seq=3863 Ack=4442 Win=131328 Len=0
560,30.769287,10.82.126.202,193.60.199.98,DNS,94,Standard query 0x268f A cp601.prod.do.dsp.mp.microsoft.com
562,30.784007,10.82.126.202,104.119.150.246,TCP,66,1951  >  443 [SYN] Seq=0 Win=64240 Len=0 MSS=1460 WS=256 SACK_PERM=1
564,30.790906,10.82.126.202,104.119.150.246,TCP,54,1951  >  443 [ACK] Seq=1 Ack=1 Win=131328 Len=0
565,30.791347,10.82.126.202,104.119.150.246,TLSv1.2,267,Client Hello
569,30.798396,10.82.126.202,104.119.150.246,TCP,54,1951  >  443 [ACK] Seq=214 Ack=2797 Win=131328 Len=0
572,30.799298,10.82.126.202,104.119.150.246,TCP,54,1951  >  443 [ACK] Seq=214 Ack=5495 Win=131328 Len=0
574,30.806356,10.82.126.202,104.119.150.246,TLSv1.2,180,"Client Key Exchange, Change Cipher Spec, Encrypted Handshake Message"
576,30.815665,10.82.126.202,104.119.150.246,TLSv1.2,593,Application Data
578,30.82449,10.82.126.202,104.119.150.246,TCP,54,"1951  >  443 [FIN, ACK] Seq=879 Ack=6710 Win=130048 Len=0"
579,30.835614,10.82.126.202,193.60.199.98,DNS,88,Standard query 0x4dfd A dl.delivery.mp.microsoft.com
581,30.843727,10.82.126.202,104.119.150.246,TCP,54,"1951  >  443 [RST, ACK] Seq=880 Ack=6741 Win=0 Len=0"
584,30.848023,10.82.126.202,2.17.115.33,TCP,66,1953  >  80 [SYN] Seq=0 Win=64240 Len=0 MSS=1460 WS=256 SACK_PERM=1
586,30.849134,10.82.126.202,2.17.115.33,TCP,54,1953  >  80 [ACK] Seq=1 Ack=1 Win=131328 Len=0
587,30.849577,10.82.126.202,2.17.115.33,HTTP,365,GET /filestreamingservice/files/16408c09-f339-4f0a-b0ad-c629da82dd25/pieceshash HTTP/1.1 
588,30.849595,10.82.126.202,52.208.191.100,TLSv1.2,85,Encrypted Alert
589,30.849714,10.82.126.202,52.208.191.100,TCP,54,"1878  >  443 [RST, ACK] Seq=32 Ack=33 Win=0 Len=0"
591,30.851119,10.82.126.202,193.60.199.98,DNS,82,Standard query 0xbce4 A nimbus.bitdefender.net
593,30.858905,10.82.126.202,52.212.19.105,TCP,66,1956  >  443 [SYN] Seq=0 Win=65535 Len=0 MSS=1460 WS=8 SACK_PERM=1
596,30.861285,10.82.126.202,2.17.115.33,TCP,54,1953  >  80 [ACK] Seq=312 Ack=1449 Win=131328 Len=0
602,30.861605,10.82.126.202,2.17.115.33,TCP,54,1953  >  80 [ACK] Seq=312 Ack=8439 Win=131328 Len=0
605,30.861811,10.82.126.202,2.17.115.33,TCP,54,1953  >  80 [ACK] Seq=312 Ack=10127 Win=131328 Len=0
607,30.867797,10.82.126.202,52.155.169.137,TCP,66,1957  >  443 [SYN] Seq=0 Win=64240 Len=0 MSS=1460 WS=256 SACK_PERM=1
608,30.870336,10.82.126.202,2.17.115.33,TCP,54,"1953  >  80 [FIN, ACK] Seq=312 Ack=10127 Win=131328 Len=0"
610,30.871256,10.82.126.202,2.17.115.33,TCP,54,1953  >  80 [ACK] Seq=313 Ack=10128 Win=131328 Len=0
611,30.875279,10.82.126.202,193.60.199.98,DNS,94,Standard query 0xf3ab A 3.tlu.dl.delivery.mp.microsoft.com
613,30.876853,10.82.126.202,52.212.19.105,TCP,54,1956  >  443 [ACK] Seq=1 Ack=1 Win=65535 Len=0
614,30.8776,10.82.126.202,52.212.19.105,TLSv1.2,571,Client Hello
617,30.883935,10.82.126.202,52.155.169.137,TCP,54,1957  >  443 [ACK] Seq=1 Ack=1 Win=131328 Len=0
618,30.884278,10.82.126.202,52.155.169.137,TLSv1.2,273,Client Hello
619,30.89009,10.82.126.202,8.238.55.254,TCP,66,1959  >  80 [SYN] Seq=0 Win=64240 Len=0 MSS=1460 WS=256 SACK_PERM=1
620,30.890917,10.82.126.202,67.26.43.254,TCP,66,1961  >  80 [SYN] Seq=0 Win=64240 Len=0 MSS=1460 WS=256 SACK_PERM=1
622,30.892093,10.82.126.202,67.26.43.254,TCP,54,1961  >  80 [ACK] Seq=1 Ack=1 Win=131328 Len=0
623,30.892315,10.82.126.202,67.26.43.254,HTTP,476,GET /filestreamingservice/files/16408c09-f339-4f0a-b0ad-c629da82dd25?P1=1600754428&P2=402&P3=2&P4=PqGdbomzs7AGg%2fukbhONiiOvbsQRox7gcH5B8WjxlKqYREVLT%2bkGPvKB3abJCSaAimGPscWxgHiLbh%2fNStkOwQ%3d%3d HTTP/1.1 
624,30.892342,10.82.126.202,52.213.158.68,TLSv1.2,271,Application Data
625,30.892385,10.82.126.202,52.213.158.68,TLSv1.2,333,Application Data
630,30.898158,10.82.126.202,52.212.19.105,TCP,54,1956  >  443 [ACK] Seq=518 Ack=2601 Win=65535 Len=0
633,30.898398,10.82.126.202,8.238.55.254,TCP,54,1959  >  80 [ACK] Seq=1 Ack=1 Win=131328 Len=0
634,30.898745,10.82.126.202,8.238.55.254,HTTP,476,GET /filestreamingservice/files/16408c09-f339-4f0a-b0ad-c629da82dd25?P1=1600754428&P2=402&P3=2&P4=PqGdbomzs7AGg%2fukbhONiiOvbsQRox7gcH5B8WjxlKqYREVLT%2bkGPvKB3abJCSaAimGPscWxgHiLbh%2fNStkOwQ%3d%3d HTTP/1.1 
635,30.899428,10.82.126.202,52.212.19.105,TLSv1.2,180,"Client Key Exchange, Change Cipher Spec, Encrypted Handshake Message"
640,30.901166,10.82.126.202,52.155.169.137,TCP,54,1957  >  443 [ACK] Seq=220 Ack=3853 Win=131328 Len=0
641,30.904439,10.82.126.202,52.155.169.137,TLSv1.2,212,"Client Key Exchange, Change Cipher Spec, Encrypted Handshake Message"
645,30.913354,10.82.126.202,8.238.55.254,HTTP,492,GET /filestreamingservice/files/16408c09-f339-4f0a-b0ad-c629da82dd25?P1=1600754428&P2=402&P3=2&P4=PqGdbomzs7AGg%2fukbhONiiOvbsQRox7gcH5B8WjxlKqYREVLT%2bkGPvKB3abJCSaAimGPscWxgHiLbh%2fNStkOwQ%3d%3d HTTP/1.1 
647,30.916115,10.82.126.202,52.212.19.105,TLSv1.2,271,Application Data
648,30.916166,10.82.126.202,52.212.19.105,TLSv1.2,210,Application Data
652,30.921042,10.82.126.202,52.155.169.137,TCP,54,1957  >  443 [ACK] Seq=378 Ack=3973 Win=131072 Len=0
653,30.921546,10.82.126.202,52.155.169.137,TLSv1.2,141,Application Data
654,30.921609,10.82.126.202,52.155.169.137,TLSv1.2,336,Application Data
655,30.921692,10.82.126.202,52.155.169.137,TLSv1.2,92,Application Data
657,30.921743,10.82.126.202,52.155.169.137,TCP,1452,1957  >  443 [ACK] Seq=785 Ack=3973 Win=131072 Len=1398 [TCP segment of a reassembled PDU]
658,30.921743,10.82.126.202,52.155.169.137,TCP,1452,1957  >  443 [ACK] Seq=2183 Ack=3973 Win=131072 Len=1398 [TCP segment of a reassembled PDU]
659,30.921743,10.82.126.202,52.155.169.137,TCP,1452,1957  >  443 [ACK] Seq=3581 Ack=3973 Win=131072 Len=1398 [TCP segment of a reassembled PDU]
660,30.921743,10.82.126.202,52.155.169.137,TCP,1452,1957  >  443 [ACK] Seq=4979 Ack=3973 Win=131072 Len=1398 [TCP segment of a reassembled PDU]
661,30.921743,10.82.126.202,52.155.169.137,TCP,1452,1957  >  443 [ACK] Seq=6377 Ack=3973 Win=131072 Len=1398 [TCP segment of a reassembled PDU]
662,30.921743,10.82.126.202,52.155.169.137,TLSv1.2,388,Application Data
664,30.921862,10.82.126.202,8.238.55.254,TCP,54,1959  >  80 [ACK] Seq=861 Ack=2481 Win=131328 Len=0
667,30.921957,10.82.126.202,8.238.55.254,TCP,54,1959  >  80 [ACK] Seq=861 Ack=5277 Win=131328 Len=0
671,30.922244,10.82.126.202,8.238.55.254,TCP,54,1959  >  80 [ACK] Seq=861 Ack=6825 Win=131328 Len=0
675,30.922973,10.82.126.202,8.238.55.254,TCP,54,1959  >  80 [ACK] Seq=861 Ack=9671 Win=131328 Len=0
680,30.925122,10.82.126.202,8.238.55.254,TCP,54,1959  >  80 [ACK] Seq=861 Ack=15263 Win=131328 Len=0
683,30.925405,10.82.126.202,8.238.55.254,TCP,54,1959  >  80 [ACK] Seq=861 Ack=17697 Win=131328 Len=0
689,30.934551,10.82.126.202,8.238.55.254,TCP,54,1959  >  80 [ACK] Seq=861 Ack=22041 Win=131328 Len=0
696,30.934751,10.82.126.202,8.238.55.254,TCP,54,1959  >  80 [ACK] Seq=861 Ack=26385 Win=131328 Len=0
700,30.93485,10.82.126.202,8.238.55.254,TCP,54,1959  >  80 [ACK] Seq=861 Ack=27833 Win=131328 Len=0
705,30.937474,10.82.126.202,8.238.55.254,TCP,54,1959  >  80 [ACK] Seq=861 Ack=33425 Win=131328 Len=0
708,30.937593,10.82.126.202,8.238.55.254,TCP,54,1959  >  80 [ACK] Seq=861 Ack=36221 Win=131328 Len=0
712,30.937751,10.82.126.202,8.238.55.254,TCP,54,1959  >  80 [ACK] Seq=861 Ack=40415 Win=131328 Len=0
717,30.93792,10.82.126.202,8.238.55.254,TCP,54,1959  >  80 [ACK] Seq=861 Ack=46007 Win=131328 Len=0
722,30.938063,10.82.126.202,8.238.55.254,TCP,54,1959  >  80 [ACK] Seq=861 Ack=50201 Win=131328 Len=0
729,30.939327,10.82.126.202,52.155.169.137,TCP,54,1957  >  443 [ACK] Seq=8109 Ack=4066 Win=131072 Len=0
732,30.939471,10.82.126.202,52.155.169.137,TCP,54,1957  >  443 [ACK] Seq=8109 Ack=4176 Win=131072 Len=0
735,30.939725,10.82.126.202,8.238.55.254,TCP,54,1959  >  80 [ACK] Seq=861 Ack=51599 Win=131328 Len=0
742,30.940748,10.82.126.202,8.238.55.254,TCP,54,1959  >  80 [ACK] Seq=861 Ack=59987 Win=131328 Len=0
748,30.940927,10.82.126.202,8.238.55.254,TCP,54,1959  >  80 [ACK] Seq=861 Ack=66977 Win=131328 Len=0
750,30.941656,10.82.126.202,8.238.55.254,TCP,54,1959  >  80 [ACK] Seq=861 Ack=68375 Win=131328 Len=0
756,30.942429,10.82.126.202,8.238.55.254,TCP,54,1959  >  80 [ACK] Seq=861 Ack=75365 Win=131328 Len=0
759,30.942524,10.82.126.202,8.238.55.254,TCP,54,1959  >  80 [ACK] Seq=861 Ack=78161 Win=131328 Len=0
764,30.942866,10.82.126.202,8.238.55.254,TCP,54,1959  >  80 [ACK] Seq=861 Ack=83753 Win=131328 Len=0
766,30.943027,10.82.126.202,8.238.55.254,TCP,54,1959  >  80 [ACK] Seq=861 Ack=85151 Win=131328 Len=0
769,30.943884,10.82.126.202,8.238.55.254,TCP,54,1959  >  80 [ACK] Seq=861 Ack=87947 Win=131328 Len=0
772,30.94408,10.82.126.202,8.238.55.254,TCP,54,1959  >  80 [ACK] Seq=861 Ack=90743 Win=131328 Len=0
777,30.944282,10.82.126.202,8.238.55.254,TCP,54,1959  >  80 [ACK] Seq=861 Ack=96335 Win=131328 Len=0
781,30.945238,10.82.126.202,8.238.55.254,TCP,54,1959  >  80 [ACK] Seq=861 Ack=100529 Win=131328 Len=0
790,30.945758,10.82.126.202,8.238.55.254,TCP,54,1959  >  80 [ACK] Seq=861 Ack=110315 Win=131328 Len=0
791,30.94584,10.82.126.202,52.155.169.137,TCP,54,1957  >  443 [ACK] Seq=8109 Ack=5616 Win=131328 Len=0
796,30.946223,10.82.126.202,52.155.169.137,TCP,54,1957  >  443 [ACK] Seq=8109 Ack=8036 Win=131328 Len=0
799,30.946378,10.82.126.202,8.238.55.254,TCP,54,1959  >  80 [ACK] Seq=861 Ack=114509 Win=131328 Len=0
807,30.946577,10.82.126.202,8.238.55.254,TCP,54,1959  >  80 [ACK] Seq=861 Ack=124295 Win=131328 Len=0
810,30.947308,10.82.126.202,8.238.55.254,TCP,54,1959  >  80 [ACK] Seq=861 Ack=127091 Win=131328 Len=0
816,30.948128,10.82.126.202,8.238.55.254,TCP,54,1959  >  80 [ACK] Seq=861 Ack=134081 Win=131328 Len=0
818,30.948229,10.82.126.202,8.238.55.254,TCP,54,1959  >  80 [ACK] Seq=861 Ack=135479 Win=131328 Len=0
823,30.948399,10.82.126.202,8.238.55.254,TCP,54,1959  >  80 [ACK] Seq=861 Ack=141071 Win=131328 Len=0
825,30.948579,10.82.126.202,52.155.169.137,TCP,54,"1957  >  443 [FIN, ACK] Seq=8109 Ack=8036 Win=131328 Len=0"
830,30.949826,10.82.126.202,8.238.55.254,TCP,54,1959  >  80 [ACK] Seq=861 Ack=148061 Win=131328 Len=0
835,30.949948,10.82.126.202,8.238.55.254,TCP,54,1959  >  80 [ACK] Seq=861 Ack=153653 Win=131328 Len=0
837,30.950075,10.82.126.202,8.238.55.254,TCP,54,1959  >  80 [ACK] Seq=861 Ack=155051 Win=131328 Len=0
843,30.95134,10.82.126.202,8.238.55.254,TCP,54,1959  >  80 [ACK] Seq=861 Ack=162041 Win=131328 Len=0
845,30.951445,10.82.126.202,8.238.55.254,TCP,54,1959  >  80 [ACK] Seq=861 Ack=163439 Win=131328 Len=0
849,30.9516,10.82.126.202,8.238.55.254,TCP,54,1959  >  80 [ACK] Seq=861 Ack=167633 Win=131328 Len=0
852,30.951736,10.82.126.202,8.238.55.254,TCP,54,1959  >  80 [ACK] Seq=861 Ack=170429 Win=131328 Len=0
854,30.952667,10.82.126.202,8.238.55.254,TCP,54,1959  >  80 [ACK] Seq=861 Ack=171827 Win=131328 Len=0
858,30.952837,10.82.126.202,8.238.55.254,TCP,54,1959  >  80 [ACK] Seq=861 Ack=176021 Win=131328 Len=0
863,30.953021,10.82.126.202,8.238.55.254,TCP,54,1959  >  80 [ACK] Seq=861 Ack=181613 Win=131328 Len=0
868,30.954394,10.82.126.202,8.238.55.254,TCP,54,1959  >  80 [ACK] Seq=861 Ack=187205 Win=131328 Len=0
877,30.954703,10.82.126.202,8.238.55.254,TCP,54,1959  >  80 [ACK] Seq=861 Ack=198389 Win=131328 Len=0
880,30.954873,10.82.126.202,8.238.55.254,TCP,54,1959  >  80 [ACK] Seq=861 Ack=201185 Win=131328 Len=0
885,30.955965,10.82.126.202,8.238.55.254,TCP,54,1959  >  80 [ACK] Seq=861 Ack=206777 Win=131328 Len=0
890,30.956161,10.82.126.202,8.238.55.254,TCP,54,1959  >  80 [ACK] Seq=861 Ack=212369 Win=131328 Len=0
895,30.956646,10.82.126.202,8.238.55.254,TCP,54,1959  >  80 [ACK] Seq=861 Ack=217961 Win=131328 Len=0
900,30.956797,10.82.126.202,8.238.55.254,TCP,54,1959  >  80 [ACK] Seq=861 Ack=223553 Win=131328 Len=0
905,30.956961,10.82.126.202,8.238.55.254,TCP,54,1959  >  80 [ACK] Seq=861 Ack=229145 Win=131328 Len=0
908,30.957104,10.82.126.202,8.238.55.254,TCP,54,1959  >  80 [ACK] Seq=861 Ack=231941 Win=131328 Len=0
910,30.957229,10.82.126.202,8.238.55.254,TCP,54,1959  >  80 [ACK] Seq=861 Ack=233339 Win=131328 Len=0
915,30.958283,10.82.126.202,8.238.55.254,TCP,54,1959  >  80 [ACK] Seq=861 Ack=238931 Win=131328 Len=0
918,30.958609,10.82.126.202,8.238.55.254,TCP,54,1959  >  80 [ACK] Seq=861 Ack=241727 Win=131328 Len=0
924,30.959577,10.82.126.202,8.238.55.254,TCP,54,1959  >  80 [ACK] Seq=861 Ack=248717 Win=131328 Len=0
931,30.959743,10.82.126.202,8.238.55.254,TCP,54,1959  >  80 [ACK] Seq=861 Ack=257105 Win=131328 Len=0
935,30.959884,10.82.126.202,8.238.55.254,TCP,54,1959  >  80 [ACK] Seq=861 Ack=261299 Win=131328 Len=0
939,30.960017,10.82.126.202,8.238.55.254,TCP,54,1959  >  80 [ACK] Seq=861 Ack=265493 Win=131328 Len=0
941,30.960186,10.82.126.202,8.238.55.254,TCP,54,1959  >  80 [ACK] Seq=861 Ack=266891 Win=131328 Len=0
946,30.960414,10.82.126.202,8.238.55.254,TCP,54,1959  >  80 [ACK] Seq=861 Ack=272483 Win=131328 Len=0
949,30.96061,10.82.126.202,8.238.55.254,TCP,54,1959  >  80 [ACK] Seq=861 Ack=275279 Win=131328 Len=0
950,30.960752,10.82.126.202,67.26.43.254,TCP,54,1961  >  80 [ACK] Seq=423 Ack=1033 Win=130304 Len=0
951,30.960786,10.82.126.202,52.213.158.68,TCP,54,1925  >  443 [ACK] Seq=1510 Ack=3884 Win=261088 Len=0
956,30.961637,10.82.126.202,8.238.55.254,TCP,54,1959  >  80 [ACK] Seq=861 Ack=280871 Win=131328 Len=0
959,30.961833,10.82.126.202,8.238.55.254,TCP,54,1959  >  80 [ACK] Seq=861 Ack=283667 Win=131328 Len=0
964,30.962244,10.82.126.202,8.238.55.254,TCP,54,1959  >  80 [ACK] Seq=861 Ack=289259 Win=131328 Len=0
970,30.962475,10.82.126.202,8.238.55.254,TCP,54,1959  >  80 [ACK] Seq=861 Ack=296249 Win=131328 Len=0
973,30.962602,10.82.126.202,8.238.55.254,TCP,54,1959  >  80 [ACK] Seq=861 Ack=299045 Win=131328 Len=0
977,30.962768,10.82.126.202,8.238.55.254,TCP,54,1959  >  80 [ACK] Seq=861 Ack=303239 Win=131328 Len=0
982,30.962969,10.82.126.202,8.238.55.254,TCP,54,1959  >  80 [ACK] Seq=861 Ack=308831 Win=131328 Len=0
985,30.963106,10.82.126.202,8.238.55.254,TCP,54,1959  >  80 [ACK] Seq=861 Ack=311627 Win=131328 Len=0
990,30.963767,10.82.126.202,8.238.55.254,TCP,54,1959  >  80 [ACK] Seq=861 Ack=317219 Win=131328 Len=0
993,30.964291,10.82.126.202,8.238.55.254,TCP,54,1959  >  80 [ACK] Seq=861 Ack=320015 Win=131328 Len=0
999,30.964741,10.82.126.202,8.238.55.254,TCP,54,1959  >  80 [ACK] Seq=861 Ack=327005 Win=131328 Len=0
1008,30.965099,10.82.126.202,8.238.55.254,TCP,54,1959  >  80 [ACK] Seq=861 Ack=338189 Win=131328 Len=0
1013,30.96603,10.82.126.202,8.238.55.254,TCP,54,1959  >  80 [ACK] Seq=861 Ack=343781 Win=131328 Len=0
1017,30.966188,10.82.126.202,52.155.169.137,TCP,54,1957  >  443 [ACK] Seq=8110 Ack=8037 Win=131328 Len=0
1018,30.966221,10.82.126.202,8.238.55.254,TCP,54,1959  >  80 [ACK] Seq=861 Ack=346577 Win=131328 Len=0
1021,30.966339,10.82.126.202,8.238.55.254,TCP,54,1959  >  80 [ACK] Seq=861 Ack=349373 Win=131328 Len=0
1026,30.967377,10.82.126.202,8.238.55.254,TCP,54,1959  >  80 [ACK] Seq=861 Ack=354965 Win=131328 Len=0
1030,30.967492,10.82.126.202,8.238.55.254,TCP,54,1959  >  80 [ACK] Seq=861 Ack=359159 Win=131328 Len=0
1034,30.967649,10.82.126.202,8.238.55.254,TCP,54,1959  >  80 [ACK] Seq=861 Ack=363353 Win=131328 Len=0
1036,30.969352,10.82.126.202,8.238.55.254,TCP,54,1959  >  80 [ACK] Seq=861 Ack=364751 Win=131328 Len=0
1040,30.969489,10.82.126.202,8.238.55.254,TCP,54,1959  >  80 [ACK] Seq=861 Ack=368945 Win=131328 Len=0
1045,30.96956,10.82.126.202,8.238.55.254,TCP,54,1959  >  80 [ACK] Seq=861 Ack=374537 Win=131328 Len=0
1047,30.969677,10.82.126.202,8.238.55.254,TCP,54,1959  >  80 [ACK] Seq=861 Ack=375935 Win=131328 Len=0
1051,30.969739,10.82.126.202,8.238.55.254,TCP,54,1959  >  80 [ACK] Seq=861 Ack=380129 Win=131328 Len=0
1053,30.969849,10.82.126.202,8.238.55.254,TCP,54,1959  >  80 [ACK] Seq=861 Ack=381527 Win=131328 Len=0
1057,30.969908,10.82.126.202,8.238.55.254,TCP,54,1959  >  80 [ACK] Seq=861 Ack=385721 Win=131328 Len=0
1059,30.970024,10.82.126.202,8.238.55.254,TCP,54,1959  >  80 [ACK] Seq=861 Ack=387119 Win=131328 Len=0
1063,30.970285,10.82.126.202,8.238.55.254,TCP,54,1959  >  80 [ACK] Seq=861 Ack=391313 Win=131328 Len=0
1065,30.970392,10.82.126.202,8.238.55.254,TCP,54,1959  >  80 [ACK] Seq=861 Ack=392711 Win=131328 Len=0
1070,30.970551,10.82.126.202,8.238.55.254,TCP,54,1959  >  80 [ACK] Seq=861 Ack=398303 Win=131328 Len=0
1074,30.97061,10.82.126.202,8.238.55.254,TCP,54,1959  >  80 [ACK] Seq=861 Ack=402497 Win=131328 Len=0
1076,30.970727,10.82.126.202,8.238.55.254,TCP,54,1959  >  80 [ACK] Seq=861 Ack=403895 Win=131328 Len=0
1080,30.973046,10.82.126.202,8.238.55.254,TCP,54,1959  >  80 [ACK] Seq=861 Ack=408089 Win=131328 Len=0
1085,30.973117,10.82.126.202,8.238.55.254,TCP,54,1959  >  80 [ACK] Seq=861 Ack=413681 Win=131328 Len=0
1087,30.973234,10.82.126.202,8.238.55.254,TCP,54,1959  >  80 [ACK] Seq=861 Ack=415079 Win=131328 Len=0
1093,30.974174,10.82.126.202,8.238.55.254,TCP,54,1959  >  80 [ACK] Seq=861 Ack=422069 Win=131328 Len=0
1097,30.97429,10.82.126.202,8.238.55.254,TCP,54,1959  >  80 [ACK] Seq=861 Ack=426263 Win=262656 Len=0
1102,30.974357,10.82.126.202,8.238.55.254,TCP,54,1959  >  80 [ACK] Seq=861 Ack=431855 Win=262656 Len=0
1107,30.974636,10.82.126.202,8.238.55.254,TCP,54,1959  >  80 [ACK] Seq=861 Ack=437447 Win=262656 Len=0
1111,30.974755,10.82.126.202,8.238.55.254,TCP,54,1959  >  80 [ACK] Seq=861 Ack=441641 Win=262656 Len=0
1116,30.974821,10.82.126.202,8.238.55.254,TCP,54,1959  >  80 [ACK] Seq=861 Ack=447233 Win=262656 Len=0
1118,30.975107,10.82.126.202,8.238.55.254,TCP,54,1959  >  80 [ACK] Seq=861 Ack=448631 Win=262656 Len=0
1122,30.975243,10.82.126.202,8.238.55.254,TCP,54,1959  >  80 [ACK] Seq=861 Ack=452825 Win=262656 Len=0
1127,30.975312,10.82.126.202,8.238.55.254,TCP,54,1959  >  80 [ACK] Seq=861 Ack=458417 Win=262656 Len=0
1129,30.975427,10.82.126.202,8.238.55.254,TCP,54,1959  >  80 [ACK] Seq=861 Ack=459815 Win=262656 Len=0
1133,30.979709,10.82.126.202,8.238.55.254,TCP,54,1959  >  80 [ACK] Seq=861 Ack=464009 Win=262656 Len=0
1136,30.979801,10.82.126.202,8.238.55.254,TCP,54,1959  >  80 [ACK] Seq=861 Ack=466805 Win=262656 Len=0
1141,30.979963,10.82.126.202,8.238.55.254,TCP,54,1959  >  80 [ACK] Seq=861 Ack=472397 Win=262656 Len=0
1145,30.980103,10.82.126.202,8.238.55.254,TCP,54,1959  >  80 [ACK] Seq=861 Ack=476591 Win=262656 Len=0
1151,30.980963,10.82.126.202,8.238.55.254,TCP,54,1959  >  80 [ACK] Seq=861 Ack=483581 Win=262656 Len=0
1155,30.981079,10.82.126.202,8.238.55.254,TCP,54,1959  >  80 [ACK] Seq=861 Ack=487775 Win=262656 Len=0
1160,30.981151,10.82.126.202,8.238.55.254,TCP,54,1959  >  80 [ACK] Seq=861 Ack=493367 Win=525568 Len=0
1163,30.981293,10.82.126.202,8.238.55.254,TCP,54,1959  >  80 [ACK] Seq=861 Ack=496163 Win=525568 Len=0
1167,30.981347,10.82.126.202,8.238.55.254,TCP,54,1959  >  80 [ACK] Seq=861 Ack=500357 Win=525568 Len=0
1169,30.981457,10.82.126.202,8.238.55.254,TCP,54,1959  >  80 [ACK] Seq=861 Ack=501755 Win=1053952 Len=0
1173,30.98152,10.82.126.202,8.238.55.254,TCP,54,1959  >  80 [ACK] Seq=861 Ack=505949 Win=1053952 Len=0
1175,30.981793,10.82.126.202,8.238.55.254,TCP,54,1959  >  80 [ACK] Seq=861 Ack=507347 Win=1053952 Len=0
1179,30.981934,10.82.126.202,8.238.55.254,TCP,54,1959  >  80 [ACK] Seq=861 Ack=511541 Win=1053952 Len=0
1184,30.982078,10.82.126.202,8.238.55.254,TCP,54,1959  >  80 [ACK] Seq=861 Ack=517133 Win=1053952 Len=0
1188,30.982215,10.82.126.202,8.238.55.254,TCP,54,1959  >  80 [ACK] Seq=861 Ack=521327 Win=1053952 Len=0
1191,30.982343,10.82.126.202,8.238.55.254,TCP,54,1959  >  80 [ACK] Seq=861 Ack=524123 Win=1053952 Len=0
1192,30.985079,10.82.126.202,52.212.19.105,TCP,54,1956  >  443 [ACK] Seq=1017 Ack=3553 Win=65535 Len=0
1197,30.986299,10.82.126.202,8.238.55.254,TCP,54,1959  >  80 [ACK] Seq=861 Ack=529715 Win=1053952 Len=0
1200,30.986447,10.82.126.202,8.238.55.254,TCP,54,1959  >  80 [ACK] Seq=861 Ack=532511 Win=1053952 Len=0
1216,30.987394,10.82.126.202,8.238.55.254,TCP,54,1959  >  80 [ACK] Seq=861 Ack=553481 Win=1053952 Len=0
1232,30.987928,10.82.126.202,8.238.55.254,TCP,54,1959  >  80 [ACK] Seq=861 Ack=574451 Win=1053952 Len=0
1235,30.988718,10.82.126.202,8.238.55.254,TCP,54,1959  >  80 [ACK] Seq=861 Ack=577247 Win=1053952 Len=0
1240,30.988854,10.82.126.202,8.238.55.254,TCP,54,1959  >  80 [ACK] Seq=861 Ack=582839 Win=1053952 Len=0
1244,30.989638,10.82.126.202,8.238.55.254,TCP,54,1959  >  80 [ACK] Seq=861 Ack=587033 Win=1053952 Len=0
1249,30.990246,10.82.126.202,8.238.55.254,TCP,54,1959  >  80 [ACK] Seq=861 Ack=592625 Win=1053952 Len=0
1253,30.990394,10.82.126.202,8.238.55.254,TCP,54,1959  >  80 [ACK] Seq=861 Ack=596819 Win=1053952 Len=0
1258,30.990563,10.82.126.202,8.238.55.254,TCP,54,1959  >  80 [ACK] Seq=861 Ack=602411 Win=1053952 Len=0
1264,30.991514,10.82.126.202,8.238.55.254,TCP,54,1959  >  80 [ACK] Seq=861 Ack=609401 Win=1053952 Len=0
1268,30.991637,10.82.126.202,8.238.55.254,TCP,54,1959  >  80 [ACK] Seq=861 Ack=613595 Win=1053952 Len=0
1273,30.991704,10.82.126.202,8.238.55.254,TCP,54,1959  >  80 [ACK] Seq=861 Ack=619187 Win=1053952 Len=0
1279,30.991983,10.82.126.202,8.238.55.254,TCP,54,1959  >  80 [ACK] Seq=861 Ack=624895 Win=1053952 Len=0
1282,30.992094,10.82.126.202,8.238.55.254,TCP,54,1959  >  80 [ACK] Seq=861 Ack=627691 Win=1053952 Len=0
1287,30.992161,10.82.126.202,8.238.55.254,TCP,54,1959  >  80 [ACK] Seq=861 Ack=633283 Win=1053952 Len=0
1289,30.992302,10.82.126.202,8.238.55.254,TCP,54,1959  >  80 [ACK] Seq=861 Ack=634681 Win=1053952 Len=0
1294,30.992486,10.82.126.202,8.238.55.254,TCP,54,1959  >  80 [ACK] Seq=861 Ack=640273 Win=1053952 Len=0
1299,30.99266,10.82.126.202,8.238.55.254,TCP,54,1959  >  80 [ACK] Seq=861 Ack=645865 Win=1053952 Len=0
1302,30.992799,10.82.126.202,8.238.55.254,TCP,54,1959  >  80 [ACK] Seq=861 Ack=648661 Win=1053952 Len=0
1306,30.992854,10.82.126.202,8.238.55.254,TCP,54,1959  >  80 [ACK] Seq=861 Ack=652855 Win=1053952 Len=0
1308,30.992975,10.82.126.202,8.238.55.254,TCP,54,1959  >  80 [ACK] Seq=861 Ack=654253 Win=1053952 Len=0
1313,31.000851,10.82.126.202,8.238.55.254,TCP,54,1959  >  80 [ACK] Seq=861 Ack=659845 Win=1053952 Len=0
1316,31.000954,10.82.126.202,8.238.55.254,TCP,54,1959  >  80 [ACK] Seq=861 Ack=662641 Win=1053952 Len=0
1320,31.001092,10.82.126.202,8.238.55.254,TCP,54,1959  >  80 [ACK] Seq=861 Ack=666835 Win=1053952 Len=0
1324,31.001249,10.82.126.202,8.238.55.254,TCP,54,1959  >  80 [ACK] Seq=861 Ack=671029 Win=1053952 Len=0
1329,31.001417,10.82.126.202,8.238.55.254,TCP,54,1959  >  80 [ACK] Seq=861 Ack=676621 Win=1053952 Len=0
1335,31.001625,10.82.126.202,8.238.55.254,TCP,54,1959  >  80 [ACK] Seq=861 Ack=683611 Win=1053952 Len=0
1339,31.001756,10.82.126.202,8.238.55.254,TCP,54,1959  >  80 [ACK] Seq=861 Ack=687805 Win=1053952 Len=0
1344,31.001916,10.82.126.202,8.238.55.254,TCP,54,1959  >  80 [ACK] Seq=861 Ack=693397 Win=1053952 Len=0
1349,31.002102,10.82.126.202,8.238.55.254,TCP,54,1959  >  80 [ACK] Seq=861 Ack=698989 Win=1053952 Len=0
1354,31.002276,10.82.126.202,8.238.55.254,TCP,54,1959  >  80 [ACK] Seq=861 Ack=704581 Win=1053952 Len=0
1359,31.002412,10.82.126.202,8.238.55.254,TCP,54,1959  >  80 [ACK] Seq=861 Ack=710173 Win=1053952 Len=0
1362,31.003402,10.82.126.202,8.238.55.254,TCP,54,1959  >  80 [ACK] Seq=861 Ack=712969 Win=1053952 Len=0
1365,31.003523,10.82.126.202,8.238.55.254,TCP,54,1959  >  80 [ACK] Seq=861 Ack=715765 Win=1053952 Len=0
1369,31.003695,10.82.126.202,8.238.55.254,TCP,54,1959  >  80 [ACK] Seq=861 Ack=719959 Win=1053952 Len=0
1371,31.003818,10.82.126.202,8.238.55.254,TCP,54,1959  >  80 [ACK] Seq=861 Ack=721357 Win=1053952 Len=0
1376,31.003905,10.82.126.202,8.238.55.254,TCP,54,1959  >  80 [ACK] Seq=861 Ack=726949 Win=1053952 Len=0
1379,31.004147,10.82.126.202,8.238.55.254,TCP,54,1959  >  80 [ACK] Seq=861 Ack=729745 Win=1053952 Len=0
1382,31.004301,10.82.126.202,8.238.55.254,TCP,54,1959  >  80 [ACK] Seq=861 Ack=732541 Win=1053952 Len=0
1387,31.004449,10.82.126.202,8.238.55.254,TCP,54,1959  >  80 [ACK] Seq=861 Ack=738133 Win=1053952 Len=0
1391,31.004575,10.82.126.202,8.238.55.254,TCP,54,1959  >  80 [ACK] Seq=861 Ack=742327 Win=1053952 Len=0
1396,31.004641,10.82.126.202,8.238.55.254,TCP,54,1959  >  80 [ACK] Seq=861 Ack=747919 Win=1053952 Len=0
1400,31.004806,10.82.126.202,8.238.55.254,TCP,54,1959  >  80 [ACK] Seq=861 Ack=752113 Win=1053952 Len=0
1406,31.004978,10.82.126.202,8.238.55.254,TCP,54,1959  >  80 [ACK] Seq=861 Ack=759103 Win=1053952 Len=0
1408,31.005078,10.82.126.202,8.238.55.254,TCP,54,1959  >  80 [ACK] Seq=861 Ack=760501 Win=1053952 Len=0
1412,31.005132,10.82.126.202,8.238.55.254,TCP,54,1959  >  80 [ACK] Seq=861 Ack=764695 Win=1053952 Len=0
1415,31.00527,10.82.126.202,8.238.55.254,TCP,54,1959  >  80 [ACK] Seq=861 Ack=767491 Win=1053952 Len=0
1417,31.005394,10.82.126.202,8.238.55.254,TCP,54,1959  >  80 [ACK] Seq=861 Ack=768889 Win=1053952 Len=0
1422,31.006398,10.82.126.202,8.238.55.254,TCP,54,1959  >  80 [ACK] Seq=861 Ack=774481 Win=1053952 Len=0
1427,31.006932,10.82.126.202,8.238.55.254,TCP,54,1959  >  80 [ACK] Seq=861 Ack=780073 Win=1053952 Len=0
1432,31.007104,10.82.126.202,8.238.55.254,TCP,54,1959  >  80 [ACK] Seq=861 Ack=785665 Win=1053952 Len=0
1438,31.008026,10.82.126.202,8.238.55.254,TCP,54,1959  >  80 [ACK] Seq=861 Ack=792655 Win=1053952 Len=0
1442,31.008162,10.82.126.202,8.238.55.254,TCP,54,1959  >  80 [ACK] Seq=861 Ack=796849 Win=1053952 Len=0
1447,31.008334,10.82.126.202,8.238.55.254,TCP,54,1959  >  80 [ACK] Seq=861 Ack=802441 Win=1053952 Len=0
1452,31.008503,10.82.126.202,8.238.55.254,TCP,54,1959  >  80 [ACK] Seq=861 Ack=808033 Win=1053952 Len=0
1457,31.008671,10.82.126.202,8.238.55.254,TCP,54,1959  >  80 [ACK] Seq=861 Ack=813625 Win=1053952 Len=0
1462,31.008857,10.82.126.202,8.238.55.254,TCP,54,1959  >  80 [ACK] Seq=861 Ack=819217 Win=1053952 Len=0
1467,31.009024,10.82.126.202,8.238.55.254,TCP,54,1959  >  80 [ACK] Seq=861 Ack=824809 Win=1053952 Len=0
1472,31.009178,10.82.126.202,8.238.55.254,TCP,54,1959  >  80 [ACK] Seq=861 Ack=829295 Win=1053952 Len=0
1477,31.009332,10.82.126.202,8.238.55.254,TCP,54,1959  >  80 [ACK] Seq=861 Ack=834887 Win=1053952 Len=0
1481,31.009464,10.82.126.202,8.238.55.254,TCP,54,1959  >  80 [ACK] Seq=861 Ack=839081 Win=1053952 Len=0
1484,31.009608,10.82.126.202,8.238.55.254,TCP,54,1959  >  80 [ACK] Seq=861 Ack=841171 Win=1053952 Len=0
1485,31.037638,10.82.126.202,8.238.55.254,TCP,54,"1959  >  80 [FIN, ACK] Seq=861 Ack=841171 Win=1053952 Len=0"
1486,31.038352,10.82.126.202,67.26.43.254,TCP,54,"1961  >  80 [FIN, ACK] Seq=423 Ack=1033 Win=130304 Len=0"
1489,31.040718,10.82.126.202,8.238.55.254,TCP,54,1959  >  80 [ACK] Seq=862 Ack=841172 Win=1053952 Len=0
1490,31.040779,10.82.126.202,67.26.43.254,TCP,54,1961  >  80 [ACK] Seq=424 Ack=1034 Win=130304 Len=0
1491,31.171253,10.82.126.202,104.119.150.246,TCP,66,1962  >  443 [SYN] Seq=0 Win=64240 Len=0 MSS=1460 WS=256 SACK_PERM=1
1493,31.179025,10.82.126.202,104.119.150.246,TCP,54,1962  >  443 [ACK] Seq=1 Ack=1 Win=131328 Len=0
1494,31.179533,10.82.126.202,104.119.150.246,TLSv1.2,267,Client Hello
1498,31.186337,10.82.126.202,104.119.150.246,TCP,54,1962  >  443 [ACK] Seq=214 Ack=2797 Win=131328 Len=0
1501,31.18834,10.82.126.202,104.119.150.246,TCP,54,1962  >  443 [ACK] Seq=214 Ack=5495 Win=131328 Len=0
1503,31.206999,10.82.126.202,104.119.150.246,TLSv1.2,180,"Client Key Exchange, Change Cipher Spec, Encrypted Handshake Message"
1505,31.214983,10.82.126.202,104.119.150.246,TLSv1.2,594,Application Data
1506,31.222251,10.82.126.202,52.114.133.60,TCP,66,1963  >  443 [SYN] Seq=0 Win=64240 Len=0 MSS=1460 WS=256 SACK_PERM=1
1508,31.225909,10.82.126.202,104.119.150.246,TCP,54,"1962  >  443 [FIN, ACK] Seq=880 Ack=6728 Win=130048 Len=0"
1510,31.232212,10.82.126.202,104.119.150.246,TCP,54,"1962  >  443 [RST, ACK] Seq=881 Ack=6759 Win=0 Len=0"
1512,31.239868,10.82.126.202,2.17.115.33,TCP,66,1965  >  80 [SYN] Seq=0 Win=64240 Len=0 MSS=1460 WS=256 SACK_PERM=1
1514,31.240947,10.82.126.202,2.17.115.33,TCP,54,1965  >  80 [ACK] Seq=1 Ack=1 Win=131328 Len=0
1515,31.24142,10.82.126.202,2.17.115.33,HTTP,366,GET /filestreamingservice/files/1d7319ea-1ab6-4263-a184-164421be7824/pieceshash HTTP/1.1 
1519,31.253151,10.82.126.202,2.17.115.33,TCP,54,1965  >  80 [ACK] Seq=313 Ack=1449 Win=131328 Len=0
1524,31.253382,10.82.126.202,2.17.115.33,TCP,54,1965  >  80 [ACK] Seq=313 Ack=5990 Win=131328 Len=0
1525,31.262324,10.82.126.202,2.17.115.33,TCP,54,"1965  >  80 [FIN, ACK] Seq=313 Ack=5990 Win=131328 Len=0"
1527,31.263339,10.82.126.202,2.17.115.33,TCP,54,1965  >  80 [ACK] Seq=314 Ack=5991 Win=131328 Len=0
1528,31.268093,10.82.126.202,193.60.199.98,DNS,94,Standard query 0x9214 A 2.tlu.dl.delivery.mp.microsoft.com
1530,31.286497,10.82.126.202,2.17.115.10,TCP,66,1967  >  80 [SYN] Seq=0 Win=64240 Len=0 MSS=1460 WS=256 SACK_PERM=1
1531,31.288078,10.82.126.202,23.55.58.104,TCP,66,1969  >  80 [SYN] Seq=0 Win=64240 Len=0 MSS=1460 WS=256 SACK_PERM=1
1533,31.288272,10.82.126.202,2.17.115.10,TCP,54,1967  >  80 [ACK] Seq=1 Ack=1 Win=131328 Len=0
1534,31.288707,10.82.126.202,2.17.115.10,HTTP,475,GET /filestreamingservice/files/1d7319ea-1ab6-4263-a184-164421be7824?P1=1600752390&P2=402&P3=2&P4=aEnxura2ZAeGtwrs2t0qOfgjURCnXMPyiYkAuXvOAP%2fLw927AdpAC6CXij2LGsKwlT3UA%2fVe9iBRqkAdt25zjg%3d%3d HTTP/1.1 
1535,31.288713,10.82.126.202,52.213.158.68,TLSv1.2,271,Application Data
1536,31.288762,10.82.126.202,52.213.158.68,TLSv1.2,331,Application Data
1538,31.289042,10.82.126.202,23.55.58.104,TCP,54,1969  >  80 [ACK] Seq=1 Ack=1 Win=131328 Len=0
1539,31.289179,10.82.126.202,23.55.58.104,HTTP,475,GET /filestreamingservice/files/1d7319ea-1ab6-4263-a184-164421be7824?P1=1600752390&P2=402&P3=2&P4=aEnxura2ZAeGtwrs2t0qOfgjURCnXMPyiYkAuXvOAP%2fLw927AdpAC6CXij2LGsKwlT3UA%2fVe9iBRqkAdt25zjg%3d%3d HTTP/1.1 
1543,31.300819,10.82.126.202,2.17.115.10,TCP,54,"1967  >  80 [FIN, ACK] Seq=422 Ack=626 Win=130560 Len=0"
1546,31.302354,10.82.126.202,2.17.115.10,TCP,54,1967  >  80 [ACK] Seq=423 Ack=627 Win=130560 Len=0
1548,31.302842,10.82.126.202,52.114.133.60,TCP,54,1963  >  443 [ACK] Seq=1 Ack=1 Win=131328 Len=0
1549,31.303231,10.82.126.202,52.114.133.60,TLSv1.2,262,Client Hello
1550,31.303349,10.82.126.202,23.55.58.104,TCP,54,"1969  >  80 [FIN, ACK] Seq=422 Ack=627 Win=130560 Len=0"
1553,31.306881,10.82.126.202,23.55.58.104,TCP,54,1969  >  80 [ACK] Seq=423 Ack=628 Win=130560 Len=0
1555,31.349725,10.82.126.202,52.213.158.68,TCP,54,1930  >  443 [ACK] Seq=1522 Ack=3850 Win=65535 Len=0
1556,31.362751,10.82.126.202,65.52.108.90,TCP,66,1970  >  443 [SYN] Seq=0 Win=64240 Len=0 MSS=1460 WS=256 SACK_PERM=1
1560,31.384266,10.82.126.202,52.114.133.60,TCP,54,1963  >  443 [ACK] Seq=209 Ack=4031 Win=131328 Len=0
1561,31.386205,10.82.126.202,52.114.133.60,TLSv1.2,147,"Client Key Exchange, Change Cipher Spec, Encrypted Handshake Message"
1564,31.595691,10.82.126.202,65.52.108.90,TCP,54,1970  >  443 [ACK] Seq=1 Ack=1 Win=131328 Len=0
1565,31.597091,10.82.126.202,65.52.108.90,TLSv1.2,264,Client Hello
1566,31.600775,10.82.126.202,52.114.133.60,TLSv1.2,1026,Application Data
1567,31.600898,10.82.126.202,52.114.133.60,TCP,1452,1963  >  443 [ACK] Seq=1274 Ack=4082 Win=131328 Len=1398 [TCP segment of a reassembled PDU]
1568,31.600898,10.82.126.202,52.114.133.60,TLSv1.2,408,Application Data
1572,31.804296,10.82.126.202,65.52.108.90,TLSv1.2,212,"Client Key Exchange, Change Cipher Spec, Encrypted Handshake Message"
1573,31.804769,10.82.126.202,52.114.133.60,TCP,54,"1963  >  443 [FIN, ACK] Seq=3026 Ack=4439 Win=130816 Len=0"
1576,31.902226,10.82.126.202,52.114.133.60,TCP,54,1963  >  443 [ACK] Seq=3027 Ack=4440 Win=130816 Len=0
1578,31.902494,10.82.126.202,65.52.108.90,TCP,54,1970  >  443 [ACK] Seq=369 Ack=1371 Win=129792 Len=0
1579,31.902791,10.82.126.202,65.52.108.90,TLSv1.2,141,Application Data
1580,31.902844,10.82.126.202,65.52.108.90,TLSv1.2,282,Application Data
1581,31.902902,10.82.126.202,65.52.108.90,TCP,1452,1970  >  443 [ACK] Seq=684 Ack=1371 Win=129792 Len=1398 [TCP segment of a reassembled PDU]
1582,31.902902,10.82.126.202,65.52.108.90,TCP,1452,1970  >  443 [ACK] Seq=2082 Ack=1371 Win=129792 Len=1398 [TCP segment of a reassembled PDU]
1583,31.902902,10.82.126.202,65.52.108.90,TCP,1452,1970  >  443 [ACK] Seq=3480 Ack=1371 Win=129792 Len=1398 [TCP segment of a reassembled PDU]
1584,31.902902,10.82.126.202,65.52.108.90,TLSv1.2,708,Application Data
1585,31.902961,10.82.126.202,65.52.108.90,TLSv1.2,92,Application Data
1592,32.106977,10.82.126.202,65.52.108.90,TCP,54,1970  >  443 [ACK] Seq=5570 Ack=2849 Win=131328 Len=0
1593,32.11817,10.82.126.202,65.52.108.90,TCP,54,"1970  >  443 [FIN, ACK] Seq=5570 Ack=2849 Win=131328 Len=0"
1595,32.312424,10.82.126.202,65.52.108.90,TCP,54,1970  >  443 [ACK] Seq=5571 Ack=2850 Win=131328 Len=0
1596,32.373164,10.82.126.202,52.114.133.60,TCP,66,1971  >  443 [SYN] Seq=0 Win=64240 Len=0 MSS=1460 WS=256 SACK_PERM=1
1597,32.556931,10.82.126.202,65.52.108.90,TCP,66,1972  >  443 [SYN] Seq=0 Win=64240 Len=0 MSS=1460 WS=256 SACK_PERM=1
1599,32.559181,10.82.126.202,52.114.133.60,TCP,54,1971  >  443 [ACK] Seq=1 Ack=1 Win=131328 Len=0
1600,32.559639,10.82.126.202,52.114.133.60,TLSv1.2,262,Client Hello
1605,32.824142,10.82.126.202,52.114.133.60,TCP,54,1971  >  443 [ACK] Seq=209 Ack=4031 Win=131328 Len=0
1606,32.82428,10.82.126.202,65.52.108.90,TCP,54,1972  >  443 [ACK] Seq=1 Ack=1 Win=131328 Len=0
1607,32.825103,10.82.126.202,65.52.108.90,TLSv1.2,264,Client Hello
1608,32.831138,10.82.126.202,52.114.133.60,TLSv1.2,147,"Client Key Exchange, Change Cipher Spec, Encrypted Handshake Message"
1611,33.045525,10.82.126.202,52.114.133.60,TLSv1.2,1026,Application Data
1612,33.047766,10.82.126.202,52.114.133.60,TCP,1452,1971  >  443 [ACK] Seq=1274 Ack=4082 Win=131328 Len=1398 [TCP segment of a reassembled PDU]
1613,33.047766,10.82.126.202,52.114.133.60,TLSv1.2,73,Application Data
1614,33.054844,10.82.126.202,65.52.108.90,TLSv1.2,212,"Client Key Exchange, Change Cipher Spec, Encrypted Handshake Message"
1615,33.1388,10.82.126.202,239.255.255.250,SSDP,143,M-SEARCH * HTTP/1.1 
1620,33.144193,10.82.126.202,65.52.108.90,TCP,54,1972  >  443 [ACK] Seq=369 Ack=1370 Win=129792 Len=0
1621,33.148229,10.82.126.202,65.52.108.90,TLSv1.2,141,Application Data
1622,33.148407,10.82.126.202,65.52.108.90,TLSv1.2,92,Application Data
1623,33.148542,10.82.126.202,65.52.108.90,TLSv1.2,282,Application Data
1624,33.14871,10.82.126.202,65.52.108.90,TCP,1452,1972  >  443 [ACK] Seq=722 Ack=1370 Win=129792 Len=1398 [TCP segment of a reassembled PDU]
1625,33.14871,10.82.126.202,65.52.108.90,TCP,1452,1972  >  443 [ACK] Seq=2120 Ack=1370 Win=129792 Len=1398 [TCP segment of a reassembled PDU]
1626,33.14871,10.82.126.202,65.52.108.90,TCP,1452,1972  >  443 [ACK] Seq=3518 Ack=1370 Win=129792 Len=1398 [TCP segment of a reassembled PDU]
1627,33.14871,10.82.126.202,65.52.108.90,TLSv1.2,708,Application Data
1628,33.154783,10.82.126.202,52.114.133.60,TCP,54,"1971  >  443 [FIN, ACK] Seq=2691 Ack=4439 Win=130816 Len=0"
1631,33.23345,10.82.126.202,65.52.108.90,TCP,54,1972  >  443 [ACK] Seq=5570 Ack=1408 Win=131328 Len=0
1635,33.234341,10.82.126.202,65.52.108.90,TCP,54,1972  >  443 [ACK] Seq=5570 Ack=1518 Win=131072 Len=0
1637,33.234573,10.82.126.202,65.52.108.90,TCP,54,1972  >  443 [ACK] Seq=5570 Ack=1560 Win=131072 Len=0
1639,33.23482,10.82.126.202,52.114.133.60,TCP,54,1971  >  443 [ACK] Seq=2692 Ack=4440 Win=130816 Len=0
1641,33.256644,10.82.126.202,65.52.108.90,TCP,54,"1972  >  443 [FIN, ACK] Seq=5570 Ack=2852 Win=131328 Len=0"
1642,33.338995,10.82.126.202,2.17.115.10,TCP,66,1975  >  80 [SYN] Seq=0 Win=64240 Len=0 MSS=1460 WS=256 SACK_PERM=1
1644,33.340796,10.82.126.202,65.52.108.90,TCP,54,"1972  >  443 [RST, ACK] Seq=5571 Ack=2894 Win=0 Len=0"
1647,33.34115,10.82.126.202,2.17.115.10,TCP,54,1975  >  80 [ACK] Seq=1 Ack=1 Win=131328 Len=0
1648,33.341764,10.82.126.202,2.17.115.10,HTTP,475,GET /filestreamingservice/files/1d7319ea-1ab6-4263-a184-164421be7824?P1=1601366359&P2=402&P3=2&P4=cGpA823mM4RM3IlFeCL3q%2ffBQJERZlViOIfNREnopulmIxddQVJrqWfEesNdaBFHgVJ4uTdJJSyCTZ%2fm7k20Yg%3d%3d HTTP/1.1 
1649,33.341983,10.82.126.202,23.55.58.104,TCP,66,1977  >  80 [SYN] Seq=0 Win=64240 Len=0 MSS=1460 WS=256 SACK_PERM=1
1652,33.348647,10.82.126.202,23.55.58.104,TCP,54,1977  >  80 [ACK] Seq=1 Ack=1 Win=131328 Len=0
1653,33.348836,10.82.126.202,23.55.58.104,HTTP,475,GET /filestreamingservice/files/1d7319ea-1ab6-4263-a184-164421be7824?P1=1601366359&P2=402&P3=2&P4=cGpA823mM4RM3IlFeCL3q%2ffBQJERZlViOIfNREnopulmIxddQVJrqWfEesNdaBFHgVJ4uTdJJSyCTZ%2fm7k20Yg%3d%3d HTTP/1.1 
1656,33.356444,10.82.126.202,2.17.115.10,HTTP,491,GET /filestreamingservice/files/1d7319ea-1ab6-4263-a184-164421be7824?P1=1601366359&P2=402&P3=2&P4=cGpA823mM4RM3IlFeCL3q%2ffBQJERZlViOIfNREnopulmIxddQVJrqWfEesNdaBFHgVJ4uTdJJSyCTZ%2fm7k20Yg%3d%3d HTTP/1.1 
1658,33.361353,10.82.126.202,23.55.58.104,HTTP,491,GET /filestreamingservice/files/1d7319ea-1ab6-4263-a184-164421be7824?P1=1601366359&P2=402&P3=2&P4=cGpA823mM4RM3IlFeCL3q%2ffBQJERZlViOIfNREnopulmIxddQVJrqWfEesNdaBFHgVJ4uTdJJSyCTZ%2fm7k20Yg%3d%3d HTTP/1.1 
1663,33.363698,10.82.126.202,2.17.115.10,TCP,54,1975  >  80 [ACK] Seq=859 Ack=5235 Win=131328 Len=0
1670,33.363997,10.82.126.202,2.17.115.10,TCP,54,1975  >  80 [ACK] Seq=859 Ack=11127 Win=131328 Len=0
1673,33.364861,10.82.126.202,2.17.115.10,TCP,54,1975  >  80 [ACK] Seq=859 Ack=13923 Win=131328 Len=0
1677,33.365151,10.82.126.202,2.17.115.10,TCP,54,1975  >  80 [ACK] Seq=859 Ack=17571 Win=131328 Len=0
1680,33.368351,10.82.126.202,23.55.58.104,TCP,54,1977  >  80 [ACK] Seq=859 Ack=2439 Win=131328 Len=0
1685,33.368498,10.82.126.202,2.17.115.10,TCP,54,1975  >  80 [ACK] Seq=859 Ack=20467 Win=131328 Len=0
1690,33.369759,10.82.126.202,2.17.115.10,TCP,54,1975  >  80 [ACK] Seq=859 Ack=23363 Win=131328 Len=0
1695,33.369909,10.82.126.202,2.17.115.10,TCP,54,1975  >  80 [ACK] Seq=859 Ack=26259 Win=131328 Len=0
1698,33.370012,10.82.126.202,23.55.58.104,TCP,54,1977  >  80 [ACK] Seq=859 Ack=5235 Win=131328 Len=0
1705,33.370231,10.82.126.202,23.55.58.104,TCP,54,1977  >  80 [ACK] Seq=859 Ack=12525 Win=131328 Len=0
1710,33.371255,10.82.126.202,2.17.115.10,TCP,54,1975  >  80 [ACK] Seq=859 Ack=30453 Win=131328 Len=0
1715,33.371527,10.82.126.202,23.55.58.104,TCP,54,1977  >  80 [ACK] Seq=859 Ack=16719 Win=131328 Len=0
1716,33.371553,10.82.126.202,2.17.115.10,TCP,54,1975  >  80 [ACK] Seq=859 Ack=33249 Win=131328 Len=0
1718,33.371932,10.82.126.202,23.55.58.104,TCP,54,1977  >  80 [ACK] Seq=859 Ack=17571 Win=130560 Len=0
1722,33.372077,10.82.126.202,2.17.115.10,TCP,54,1975  >  80 [ACK] Seq=859 Ack=37443 Win=131328 Len=0
1727,33.372258,10.82.126.202,2.17.115.10,TCP,54,1975  >  80 [ACK] Seq=859 Ack=43035 Win=131328 Len=0
